ID,Title,Text,Status1654154,"Kaiyah Horton-Seawright, sympathy","








A house RESOLUTION

TO EXPRESS THE PROFOUND SORROW OF THE MEMBERS OF THE SOUTH CAROLINA HOUSE OF REPRESENTATIVES UPON THE PASSING OF KAIYAH T'SELANI TYANNA HORTON-SEAWRIGHT OF COLUMBIA, TO CELEBRATE HER LIFE, AND TO EXTEND THE DEEPEST SYMPATHY TO HER FAMILY AND MANY FRIENDS.

Whereas, the members of the South Carolina House of Representatives were deeply saddened by the untimely passing of Kaiyah T'selani Tyanna Horton-Seawright of Columbia on January 5, 2023, at the age of twenty-one; and

Whereas, born in Columbia on June 7, 2001, Kaiyah was the daughter of Tawana Horton and Cohran ""Tiwan"" Seawright. A proud 2019 Spring Valley High School graduate, Kaiyah enrolled at the University of South Carolina Aiken and transferred to Benedict College in Columbia in 2022. She was pursuing a degree in sports medicine; and

Whereas, Kaiyah's personality was larger than life. Her smile was contagious and her laugh, infectious. That smile drew you in, allowing you to see her immeasurable kindness and compassion for others. Her buoyant personality led her to a love for cheering and gymnastics. In high school, she was a member of the cheerleading squad and participated in competitions. She had a flair for all things fashion and prided herself on being able to ""change it up"" at will. Spending time with good friends and making new friends were two of her favorite pastimes; and

Whereas, her love for her family and friends was surpassed only by their love for her. She loved life and lived her brief life to the fullest, always encouraging those around her to do the same; and

Whereas, preceded in death by her maternal grandmother, Barbara Horton, Kaiyah leaves to cherish her memory her parents, Tawana Horton and Tiwan Seawright, both of Columbia; her maternal grandfather, Wallace Ford of Columbia; her paternal grandparents, Margaret and Eugene Seawright of Swansea; four aunts, Roselyn (Marcus) Freeman, Chandor Horton, Candace Horton, and Marcia M. Seawright; four uncles, Cedric Ford, Reginald Brown, Marcus Eugene Seawright, and Antjuan O. Seawright; her siblings, Robert Nicholas ""Nick"" Harrell and Milana Demur'e Seawright of Columbia; a cousin who was like a sister, Cinica Pugh of Columbia; as well as a host of other loving family members and dear friends. She will be greatly missed. Now, therefore,

Be it resolved by the House of Representatives:

That the members of the South Carolina House of Representatives, by this resolution, express their profound sorrow upon the passing of Kaiyah T'selani Tyanna Horton-Seawright of Columbia, celebrate her life, and extend the deepest sympathy to her family and many friends.

Be it further resolved that a copy of this resolution be presented to the family of Kaiyah T'selani Tyanna Horton-Seawright.
----XX----
",Passed
1655753,Crescent HS sporting clays national champs,"








A house RESOLUTION

TO RECOGNIZE AND HONOR THE CRESCENT HIGH SCHOOL SPORTING CLAYS TEAM, COACHES, AND SCHOOL OFFICIALS FOR AN OUTSTANDING SEASON AND TO CONGRATULATE THEM ON WINNING THE 2022 SCHOLASTIC CLAY TARGET PROGRAM NATIONAL CHAMPIONSHIP TITLE.

Whereas, the South Carolina House of Representatives is pleased to learn that the members of the Crescent High School sporting clays team won the Scholastic Clay Target Program's national competition, held at the Cardinal Center in Marengo, Ohio, on July 15-16, 2022; and

Whereas, to the delight of enthusiastic Tiger fans, the Crescent Elite Shooters bested all comers with a final team score of 522 out of a possible 600 points in the championship tournament; and

Whereas, the Crescent High squad included sophomore Jed Dodgens, who led the way with 179 of 200 points; eighth-grader Quaid Busby, who contributed 173 of 200 points; and sophomore Maddox Martin, who nailed 170 of 200 points; and

Whereas, the team captured first place in the Sporting Clays Open Division; and

Whereas, in a sport that demands expertise and accuracy, Coach Lester Brock, Coach Rick Dodgens, and Coach Phillip Martin maximized their own ability and training in sporting clays to produce a championship caliber team and teach these athletes lessons that will prove invaluable throughout life; and

Whereas, the South Carolina House of Representatives values the pride and recognition that the Crescent High School sporting clays team has brought to its school and community, and the members look to hear of the team's future success in the days to come. Now, therefore,

Be it resolved by the House of Representatives:

That the members of the South Carolina House of Representatives, by this resolution, recognize and honor the Crescent High School sporting clays team, coaches, and school officials for an outstanding season and congratulate them on winning the 2022 Scholastic Clay Target Program National Championship title.

Be it further resolved that a copy of this resolution be presented to Principal Cliff Roberts, Coach Lester Brock, Coach Rick Dodgens, and Coach Phillip Martin.
----XX----
",Passed
1655756,Luther Lynard sympathy,"








A house RESOLUTION

TO EXPRESS THE PROFOUND SORROW OF THE MEMBERS OF THE SOUTH CAROLINA HOUSE OF REPRESENTATIVES UPON THE PASSING OF LUTHER ""CAP"" LYNARD, SR., OF BEAUFORT COUNTY AND TO EXTEND THEIR DEEPEST SYMPATHY TO HIS LARGE AND LOVING FAMILY AND HIS MANY FRIENDS.

Whereas, the members of the South Carolina House of Representatives were saddened to learn of the death of Luther ""Cap"" Lynard, Sr., at the age of eighty-six on December 7, 2022; and

Whereas, born on May 9, 1936, Mr. Lynard was the oldest of five children born to the late Fred and Suzanna ""Nettie"" Lynard; and

Whereas, a resident of St. Helena Island, he was the owner of Lynard Tile Company for over thirty years, and many people living in beautiful homes on Hilton Head Island appreciate his fine tile work in their kitchens and bathrooms; and

Whereas, Mr. Lynard was married to his beloved wife, Deborah Singleton ""Deb"" Lynard for the past fifty-four years, and he had five children in whom he delighted; and

Whereas, his children blessed him with the devotion of many loving grandchildren and great-grandchildren, who affectionately called him ""Granddaddy Luke.""  He was very appreciative of his granddaughter Latoya Lynard who attended to him with an unselfish spirit as if she were his daughter; and

Whereas, an avid fisherman who even loved to clean fish, Mr. Lynard has many who will cherish their fond memories of him: Abraham Williams of Castle Rock, Colorado; Melvin Brown of St. Helena Island; Sherri Mack of Stafford, Virginia; Luther Lynard, Jr., of Tom Fripp Plantation; and Michael Lynard of Midway, Georgia; and

Whereas, the members of the South Carolina House of Representatives are grateful for the life and legacy of Cap Lynard and for the outstanding example of service and kindness he set for all who knew him.  Now, therefore,

Be it resolved by the House of Representatives:

That the members of the South Carolina House of Representatives, by this resolution, express their profound sorrow upon the passing of Luther ""Cap"" Lynard of Beaufort County and extend their deepest sympathy to his large and loving family and his many friends.

Be it further resolved that a copy of this resolution be presented to the family of Luther ""Cap"" Lynard.
----XX----
",Passed
1655772,John McMahan shooting awards,"








A house RESOLUTION

TO RECOGNIZE AND HONOR Captain jOHN mCmAHAN, supervisor of the firearms and driving range at the SOUTH CAROLINA Criminal JUSTICE Academy, FOR HIS OUTSTANDING PERFORMANCE REPRESENTING THE PALMETTO STATE AT NUMEROUS SHOTGUN SHOOTING EVENTS.

Whereas, for twenty-five years, Captain John McMahan has worked at the South Carolina Criminal Justice Academy where he currently serves as the supervisor of the firearms and driving range; and

Whereas, he began attending the Police/Fire Olympics in 2007 locally, statewide, regionally, nationally, and internationally, including Florida Police and Fire Games, Georgia Police and Fire Games, National First Responder Games, Can-Am Police-Fire Games, International Police/Fire Olympics, and World Police and Fire Games; and

Whereas, in 2006, he was inducted into the South Carolina State Skeet Hall of Fame, and in 2008, he was the gold medal high-overall shooter at the last International Police/Fire Olympics hosted in Orlando, Florida.  At the World Police and Fire Games in New York in 2011 and in Virginia in 2015, he was the only American on the high overall skeet shooting podium.  Italian and British shooters occupied the other spots; and

Whereas, during 2021 and 2022, Captain McMahan attended numerous shooting events as a representative of both the South Carolina Criminal Justice Academy and the state's first responders.  He participated in the shotgun shooting events, which included skeet, trap, and sporting clays and which were usually spread out over a period of three days; and

Whereas, in June of 2021, he attended the National First Responder Games in Sarasota, Florida.  After three days of competition and 450 targets, he won the High Overall ""Top Gun"" Award and accumulated nine gold medals, one silver medal, and one bronze medal, for individual and team events; and

Whereas, in the same month, Captain McMahan attended the one-day competition of the Georgia Police and Fire Games to enter the shotgun shooting event, the first year Georgia had opened its competition to other states, and he was awarded the gold medal for the highest overall score; and

Whereas, in June of 2022, he returned to the National First Responder Games in Sarasota, Florida, and over the three days with 450 targets, he reclaimed his trophy for the High Overall ""Top Gun"" Award and again garnered numerous awards: eight gold medals, three silver medals, and one bronze medal, for individual and team events; and 

Whereas, returning to the Georgia Police and Fire Games in June of 2022 for the one-day shotgun shooting event, Captain McMahan was awarded the gold medal for the highest overall score; and

Whereas, in July of that year, he attended the Can-Am Police-Fire Games in Detroit, Michigan, a three-day event with a total of 600 targets.  With shooters from the United States, Canada, and Great Britain competing, he captured nine gold medals, two silver medals, and three bronze medals, and was recognized for the High Overall top score; and

Whereas, Captain McMahan has earned a total of one hundred forty-eight medals: ninety-three gold medals, forty-four silver medals, and eleven bronze; and

Whereas, the South Carolina House of Representatives deeply appreciates the pride and recognition that John McMahan has brought to this State and to the South Carolina Criminal Justice Academy, and the members look forward to hearing of his continued success in the days ahead.  Now, therefore,

Be it resolved by the House of Representatives:

That the members of the South Carolina House of Representatives, by this resolution, recognize and honor Captain John McMahan, supervisor of the firearms and driving range at the South Carolina Criminal Justice Academy, for his outstanding performance representing the Palmetto State at numerous shotgun shooting events.

Be it further resolved that a copy of this resolution be presented to Captain John McMahan.
----XX----
",Passed
1655776,Michael Harriot,"








A house RESOLUTION

TO RECOGNIZE AND HONOR MICHAEL HARRIOT FOR HIS CONTRIBUTIONS AS A WRITER, POET, CULTURAL CRITIC, JOURNALIST, AND BROADCASTER, and to wish him CONTINUED success in ALL his future endeavors.

Whereas, those who give their lives to the betterment of their community deserve to be publicly recognized for their contributions in making the State and the nation a better place to live; and

Whereas, Michael Harriot is such a person, having devoted his life to writing about the issues that face Black Americans in this country; and

Whereas, a native of Hartsville, Michael Harriot was born the son of Dorothy Harriot and the grandson of Marvell and James ""Buck"" Harriot. He earned degrees in mass communications and history from Auburn University and master's degrees in macroeconomics and international business from Florida State University; and 

Whereas, Mr. Harriot works as a writer at TheGrio, is a contributing columnist at The Guardian, and is a staff writer for Peacock's The Amber Ruffin Show. He is also the host of theGrio Daily podcast; and

Whereas, Mr. Harriot has garnered numerous awards and recognitions for his work in journalism and broadcasting. In 2019, he received awards for Daily Commentary and Public Affairs Programming from the National Association of Black Journalists (NABJ). In 2021, he received the Trailblazer Award from the New York Association of Black Journalists, was awarded the Professional Salute to Excellence Award by the NABJ, and received an Emmy nomination for his writing on NBC Peacock's The Amber Ruffin Show; and

Whereas, Mr. Harriot is scheduled to speak at People to People of Hartsville's annual Dr. Martin Luther King, Jr. Commemorative Award Service on January 16, 2022, at Jerusalem Baptist Church in Hartsville. Now, therefore,

Be it resolved by the House of Representatives:

That the members of the South Carolina House of Representatives, by this resolution, recognize and honor Michael Harriot for his contributions as a writer, poet, cultural critic, journalist, and broadcaster, and wish him continued success in all his future endeavors.

Be it further resolved that a copy of this resolution be presented to Mr. Michael Harriot.
----XX----
",Passed
1655798,Patricia Hunt-Fisher 90th birthday,"








A house RESOLUTION

TO CONGRATULATE  Patricia Hunt-Fisher OF Greenville COUNTY ON THE OCCASION OF HER ninetieTH BIRTHDAY AND TO WISH HER A JOYOUS BIRTHDAY CELEBRATION AND MANY YEARS OF CONTINUED HEALTH AND HAPPINESS.

Whereas, the members of the South Carolina House of Representatives are delighted to learn that  Patricia Hunt-Fisher of Greenville County will celebrate her ninetieth birthday on February 24, 2023; and 

Whereas, born on February 24, 1933, during the Great Depression of the twentieth century, she has witnessed the many remarkable social changes, technological advancements, and international developments that have spanned the globe from that time into the first quarter of the twenty-first century; and 

Whereas, during her nine decades, Mrs. Hunt-Fisher has instilled the love of music into thousands of students in the Upstate of South Carolina; and
 
Whereas, for almost four decades, she was the chorus teacher at Travelers Rest High School, where thousands of students began to develop a love of music through her teaching.  She was affectionately known as ""Mama Hunt"" to countless students; and
 
Whereas, many wonderful people are working to create a fitting tribute to Mrs. Hunt-Fisher on Saturday, February 25, 2023, at Travelers Rest High School to honor her life and legacy.  On that evening, students from her teaching career that spanned four decades will assemble to perform a once-in-a-lifetime concert honoring this remarkable woman and celebrate the impact she has had on the Upstate of South Carolina, which now has spread through her students to all parts of the United States; and
 
Whereas, after retiring, Mama Hunt has not slowed down.  Her example has taught many the art of never stopping learning even after retirement; and

Whereas, she has served as the organist at her home church, Reedy River Baptist Church, for several decades, and when needed, she has served as the church's music director; and

Whereas, the members of the South Carolina House of Representatives are pleased to honor this daughter of South Carolina at the celebration of her ninetieth birthday and join with her family and friends in congratulating her on reaching this extraordinary milestone.  Now, therefore,

Be it resolved by the House of Representatives:

That the members of the South Carolina House of Representatives, by this resolution, congratulate Patricia Hunt-Fisher of Greenville County on the occasion of her ninetieth birthday and wish her a joyous birthday celebration and many years of continued health and happiness.

Be it further resolved that a copy of this resolution be presented to Patricia Hunt-Fisher.
----XX----
",Passed
1655804,Kathleen Jennings,"








A house RESOLUTION

TO CONGRATULATE AND COMMEND GREENVILLE NATIVE KATHLEEN JENNINGS FOR A LIFETIME OF OUTSTANDING AND MEANINGFUL ACHIEVEMENTS.

Whereas, the South Carolina House of Representatives is pleased to honor Kathleen Jennings for her many years of service to her community and State. Kathleen comes by her interest in serving others naturally. Her father was Greenville Police Chief Harold C. Jennings, and her grandfather was Police Chief James Herman Jennings, who served as police chief of both Fountain Inn and Greenville. Further, Kathleen is a descendant of Governor Benjamin Franklin Perry, who served during Reconstruction; and

Whereas, in preparation for her life's work, she earned her bachelor's degree at the University of South Carolina, where she served as student body secretary and student senator. Kathleen went on to receive her Juris Doctor from the University of South Carolina School of Law. Her son, attorney Jay Jennings Gresham, an assistant solicitor, has followed his mother's example of service; and

Whereas, Kathleen served as the first woman prosecutor in Upstate South Carolina, and has been passionate through the years about children's and elderly rights, including founding ""Child Safe""; and

Whereas, grateful for her long years of service, the House takes great pleasure in recognizing Kathleen Jennings and in wishing her much success and fulfillment as she continues to serve in the days ahead. Now, therefore, 

Be it resolved by the House of Representatives:

That the members of the South Carolina House of Representatives, by this resolution, congratulate and commend Greenville native Kathleen Jennings for a lifetime of outstanding and meaningful achievements.

Be it further resolved that a copy of this resolution be presented to Kathleen Jennings.
----XX----
",Passed
1655811,Dale Rosengarten retirement,"








A house RESOLUTION

TO RECOGNIZE AND HONOR Dale Rosengarten, curator of the Jewish Heritage Collection at the College of Charleston, UPON THE OCCASION OF HER RETIREMENT AFTER thirty YEARS OF EXEMPLARY SERVICE, AND TO WISH HER CONTINUED SUCCESS AND HAPPINESS IN ALL HER FUTURE ENDEAVORS.

Whereas, it is altogether fitting and proper that the South Carolina House of Representatives should pause in its deliberations to express gratitude to Dale Rosengarten for her significant contributions to the Jewish Heritage Collection as she begins her retirement on February 15, 2023; and

Whereas, after earning a bachelor's degree and a doctorate from Harvard University, Ms. Rosengarten moved to McClellanville in 1976, near the source of the coiled sweetgrass basket, an icon of Gullah and Geechee cultures.  By 1986, she had authored Row upon Row: Sea Grass Baskets of the South Carolina Lowcountry, the first comprehensive history of the coiled sweetgrass basket; and 

Whereas, she founded the Jewish Heritage Collection in 1995 and served as its curator for twenty-seven years, during which she amassed a vast collection of family papers, photographs, memoirs, objects, and congregational and organizational records pertaining to Jewish life in South Carolina.  In 2000, she expanded the mission of the Jewish Heritage Collection to include documentation of the Holocaust with photographs and artifacts from survivors and liberators who had ties to South Carolina; and

Whereas, working with McKissick Museum at the University of South Carolina, Ms. Rosengarten developed the landmark traveling exhibition in 2002, A Portion of the People: Three Hundred Years of Southern Jewish Life, and co-edited a book by the same name, which has altered the perception historians have about Jewish history and the creation of American Jewish religious identity; and

Whereas, in 2014, Ms. Rosengarten, with the Jewish Historical Society of South Carolina and the Yaschik/Arnold Jewish Studies Program at the College of Charleston, established  the Pearlstine/Lipov Center for Southern Jewish Culture to broaden public knowledge of Southern Jewish experience; and

Whereas, for some three decades, she worked diligently with volunteers to record six hundred oral histories, including panel discussions, presentations, and interviews with individuals in towns and cities across the State to preserve the stories of three generations of Jewish South Carolinians; and 

Whereas, along with the Jewish Historical Society of South Carolina, Ms. Rosengarten planned and implemented numerous meetings of the Society across South Carolina.  She served as the editor of the Jewish Historical Society of South Carolina's semi-annual magazine, producing nearly thirty issues; and

Whereas, in 2010, Ms. Rosengarten co-curated Grass Roots: African Origins of an American Art, a ground-breaking exhibition at the National Museum of African Art, Smithsonian Institution, in Washington, D.C.; and

Whereas, with her husband, Theodore Rosengarten, she led College of Charleston undergraduate and graduate students in study-abroad trips to Holocaust and Jewish cultural sites in Central and Eastern Europe.  She was instrumental developing three pioneering digital public history exhibits; and 

Whereas, in 2016, Ms. Rosengarten co-curated the exhibition, By Dawn's Early Light: Jewish Contributions to American Culture from the Nation's Founding to the Civil War, which was on view at the Princeton University Art Museum and then at the New York Historical Society; and

Whereas, in 2019, she was honored with both the Folk Heritage Award from the South Carolina Arts Commission for her work researching the sweetgrass-basketry tradition for over thirty years and the Order of the Jewish Palmetto, the highest honor of the Jewish Historical Society of South Carolina; and

Whereas, grateful for her many years of distinguished service to preserve the heritage of Jewish history in this State, the South Carolina House of Representatives takes great pleasure in extending best wishes to Dale Rosengarten as she transitions to a richly deserved retirement and the unhurried pace of the days ahead, and the members wish her much enjoyment in her well-earned retirement.  Now, therefore,

Be it resolved by the House of Representatives:

That the members of the South Carolina House of Representatives, by this resolution, recognize and honor Dale Rosengarten, curator of the Jewish Heritage Collection at the College of Charleston, upon the occasion of her retirement after thirty years of exemplary service, and wish her continued success and happiness in all her future endeavors.

Be it further resolved that a copy of this resolution be presented to Dale Rosengarten.
----XX----
",Passed
1655815,"Pamela Metts, retirement","








A house RESOLUTION

TO HONOR PAMELA METTS OF GREENWOOD UPON THE OCCASION OF HER RETIREMENT from the south carolina judicial department AND TO WISH HER success and happiness IN ALL HER FUTURE ENDEAVORS.

Whereas, in December 2021, Pamela Metts began a well-deserved retirement after eighteen years of distinguished service with the Greenwood County Family Court as a highly regarded administrative assistant. Having worked within the South Carolina Judicial Department as administrative assistant to Judge Billy A. Tunstall until July 2012, Ms. Metts next took up her duties as administrative assistant to Judge Joseph C. Smithdeal, the post from which she retired; and

Whereas, beloved by all attorneys and judges, she clearly enjoyed her work in family court, was a loyal and cheerful employee, and proved a great asset to the department. During her retirement, Pamela Metts is relishing having more leisure time for her hobbies, reading, and creating wreaths. In addition, her two sons, Jeffrey and Bradley Minor, have given her the delight of four grandchildren to treasure, Morgan, Briggs, Summer, and Brooks; and

Whereas, the members of the House are grateful for the many years of distinguished service Pamela Metts gave to the Greenwood County Family Court and the South Carolina Judicial Department and extend best wishes to her as she takes full advantage of the unhurried pace of her retirement. Now, therefore,

Be it resolved by the House of Representatives:

That the members of the South Carolina House of Representatives, by this resolution, honor Pamela Metts of Greenwood upon the occasion of her retirement from the South Carolina Judicial Department and wish her success and happiness in all her future endeavors.

Be it further resolved that a copy of this resolution be presented to Pamela Metts.
----XX----
",Passed
