ID,Title,Text,Status1650833,Farewell to Rep. K. Matthews,"








A house RESOLUTION

TO COMMEND THE HONORABLE KRYSTLE N. MATTHEWS ON HER MERITORIOUS SERVICE IN THE SOUTH CAROLINA HOUSE OF REPRESENTATIVES AND TO WISH HER CONTENTMENT AND SUCCESS IN ALL HER FUTURE ENDEAVORS.

Whereas, for two years, the Honorable Krystle N. Matthews faithfully represented the citizens of Berkeley and Charleston counties, District 117, in the House of Representatives of this great State; and

Whereas, born the daughter of Robert and Elizabeth Matthews, she is a native of Sandusky, Ohio. Presently a resident of Ladson, South Carolina, Krystle Matthews serves her community as an engineering planner; and

Whereas, during her time of service in the House of Representatives, Krystle Matthews proved her worth as a member of the Medical, Military, Public and Municipal Affairs Committee, which she served as secretary, and the Operations and Management Committee, which she served as both secretary and treasurer; and

Whereas, Krystle finds strong support for her labors in her family of five: Trushaun, Brooklyn, Devin, Bryan, and Aniya; and

Whereas, on the occasion of her departure from the House of Representatives, her House colleagues, grateful for Krystle N. Matthews' committed service to this body and the people of District 117, extend warmest best wishes for much fulfillment and happiness in this new phase of her life. Now, therefore,

Be it resolved by the House of Representatives:

That the members of the South Carolina House of Representatives, by this resolution, commend the Honorable Krystle N. Matthews on her meritorious service in the South Carolina House of Representatives and wish her contentment and success in all her future endeavors.

Be it further resolved that a copy of this resolution be presented to Krystle N. Matthews.
----XX----
",Passed
1650962,"St. James Elementary, National Blue Ribbon School","








A senate RESOLUTION

TO CONGRATULATE THE STUDENTS, TEACHERS, ADMINISTRATORS, AND STAFF OF st. james ELEMENTARY SCHOOL IN MYRTLE BEACH ON THEIR SCHOOL'S RECEIVING A 2022 NATIONAL BLUE RIBBON AWARD.

Whereas, the South Carolina Senate is pleased to honor St. James Elementary School in Myrtle Beach on being named a National Blue Ribbon School in September 2022; and

Whereas, presented by the United States Department of Education, the award is the highest honor a school can receive from that institution; and

Whereas, the National Blue Ribbon Schools program recognizes K-12 schools based on their overall academic excellence or their progress in closing student achievement gaps. St. James is among two hundred ninety-seven 2022 nationwide winners; and

Whereas, St. James Elementary earned its National Blue Ribbon Schools distinction for exemplary high performance measured by its student achievement, which placed the school in the top 15% on state assessments for English language arts and mathematics; and

Whereas, further, under the leadership of Principal Felisa McDavid, St. James's administration, faculty, and staff have convincingly demonstrated their commitment to excellence, a commitment that has led to St. James's being consistently ranked as Horry County Schools' top-performing elementary school in the areas of mathematics and/or English language arts; and

Whereas, it is with great pleasure that the South Carolina Senate salutes St. James Elementary School on its exemplary educational success, and the members extend their appreciation for the excellence the school continues to achieve as it nurtures our most precious resource, our children. Now, therefore,

Be it resolved by the Senate:

That the members of the South Carolina Senate, by this resolution, congratulate the students, teachers, administrators, and staff of St. James Elementary School in Myrtle Beach on their school's receiving a 2022 National Blue Ribbon award.

Be it further resolved that a copy of this resolution be presented to St. James Elementary School.
----XX----
",Passed
1650970,Retirement of Rep. KO Johnson,"








A house RESOLUTION

TO RECOGNIZE AND COMMEND THE HONORABLE Kimberly O. Johnson OF clarendon COUNTY FOR Her DEDICATED SERVICE IN THE HOUSE OF REPRESENTATIVES ON BEHALF OF her CONSTITUENTS AND THE CITIZENS OF SOUTH CAROLINA AND TO WISH her MUCH SUCCESS AND HAPPINESS IN ALL her FUTURE ENDEAVORS.

Whereas, the members of the South Carolina House of Representatives learned with sincere regret that Representative Kimberly Johnson will depart from the House of Representatives at the conclusion of her current term; and 

Whereas, she is the daughter of Kevin L. and Gloria I. ""Bee"" Johnson, and she earned a bachelor's degree in religious studies in 2006 and a master's degree in social work in 2009 from the University of South Carolina; and 

Whereas, in the patriotic tradition of the Palmetto State, Representative Johnson served in the United States Army from 1998 to 2005; and 

Whereas, when away from her duties in the House of Representatives, she resides in Manning and serves as the director of community engagement with HopeHealth; and 

Whereas, deeply involved in her community, Representative Johnson served as the chairman of the Clarendon Two Board of Trustees from 2013 to 2020, as the regional director of the South Carolina School Board Association from 2017 to 2020; and as the president of the Clarendon County Chamber of Commerce from 2017 to 2019; and 

Whereas, this lifelong resident of Manning is a Riley Fellow, having graduated from The Riley Institute at Furman University, an Education Fellow, having graduated from the South Carolina Education Policy Fellowship Program, and a graduate of Leadership Clarendon and Leadership South Carolina; and

Whereas, she has faithfully served the citizens of Clarendon and Sumter counties in District 64 in the House of Representatives since 2021, most recently during that time she served on the Legislative Oversight and on the Medical, Military, Public and Municipal Affairs committees; and 

Whereas, during her service, Representative Johnson has provided devoted attention to her colleagues and her duties to her constituents; and 

Whereas, the members of the House of Representatives will miss the keen and ardent service that Kimberly Johnson, their friend and colleague, has given to the House of Representatives and hope that she will enjoy deep fulfillment in the years to come.  Now, therefore,

Be it resolved by the House of Representatives:

That the members of the South Carolina House of Representatives, by this resolution, recognize and commend the Honorable Kimberly O. Johnson of Clarendon County for her dedicated service in the House of Representatives on behalf of her constituents and the citizens of South Carolina and wish her much success and happiness in all her future endeavors.

Be it further resolved that a copy of this resolution be presented to the Honorable Kimberly O. Johnson. 
----XX----
",Passed
1651013,Lynn McGee retirement,"








A senate RESOLUTION

TO RECOGNIZE AND HONOR Dr. Lynn W. McGee, A Senior executive AND PROFESSOR AT THE UNIVERSITY OF SOUTH CAROLINA BEAUFORT, UPON THE OCCASION OF HER RETIREMENT AFTER YEARS OF OUTSTANDING SERVICE, AND TO WISH HER CONTINUED SUCCESS AND HAPPINESS IN ALL HER FUTURE ENDEAVORS.

Whereas, in preparation for her life's career in higher education leadership, Lynn McGee earned a bachelor's degree from Agnes Scott College in Decatur, Georgia, where she served on the Honor Court, played tennis for four years, was inducted into Phi Beta Kappa, and graduated summa cum laude and as valedictorian with a double major in English and mathematics. She also was awarded a Rotary scholarship to the University of Oslo International Summer School; and

Whereas, she continued her educational pursuits, earning a master's degree in business administration from the University of North Carolina Kenan Flagler School of Business where she held the prestigious Morehead Fellowship. She was then awarded the John Edwards Fellowship at Indiana University Kelley School of Business, where she earned a doctorate in business marketing and served as associate instructor from 1984-1986; and 

Whereas, Dr. McGee served as vice chancellor for advancement and external relations in Beaufort, Bluffton, and Hilton Head Island for USCB from 2006-2018, during which time USCB doubled in enrollment to 2,000 students, built two new campuses, and opened campus housing to a capacity of over 1,100 beds. A nascent athletics program expanded to nine varsity sports in the NAIA Sun Conference. By 2018, USCB offered 18 undergraduate degrees on three campuses. She served USCB on the Chancellor's Cabinet, the Southern Association of Colleges and Schools' (SACS) Accreditation Team in 2009 and 2019 and Re-affirmation in 2014, and the Study Abroad Committee from 2015-2018, as well as chair of the Commencement Committee from 2008-2016; and

Whereas, Dr. McGee's most noteworthy state-wide achievement at USCB was her successful leadership of the Parity for Students initiative in 2014, an improved funding formula put in place by the General Assembly for the three participating regional campuses, USC Aiken, USC Upstate, and USCB, resulting in enriched and expanded programs at all three campuses. Some ten thousand students per year across the State have benefitted from this initiative's recurring funding; and

Whereas, Dr. McGee's professional recognitions have been many and include: a Fulbright Scholar Award, the first received by an USCB faculty or staff member; the 2014 Circle of Excellence International Gold Award from the Council for the Advancement and Support of Education, its highest award worldwide; the Edwin Crawford Award for Innovation in State Government Relations in 2015; and the SAI Programs Staff Leadership Grant in 2019; and

Whereas, she has served her community as a member of Beaufort Rotary Club/Sea Islands Rotary Club since 2011, on the Hilton Head Island Chamber Government Relations Committee from 2012-2018, and as a member of the South Carolina Fulbright Association since 2016, chosen to serve as its vice president from 2020-2024.  She has served the international community as an independent marketing consultant since 1990, and on the World Affairs Council of Hilton Head since 2021; and

Whereas, together with her beloved husband, David McGee, she reared four outstanding sons.  After completing her doctorate, Dr. McGee paused her career to homeschool her sons in their early years.  A faithful member of Grace Coastal Church, she serves as a children's Sunday school teacher, and she has served the Boy Scouts of America Troop 213, for which she has received several honors; and 

Whereas, grateful for her years of unparalleled service to USCB, the Senate extends best wishes to Lynn McGee in her transition to a richly deserved retirement, and the members wish her many years of enjoyment in her well-earned retirement begun in late September 2022.  Now, therefore,

Be it resolved by the Senate:

That the members of the South Carolina Senate, by this resolution, recognize and honor Dr. Lynn W. McGee, a senior executive and professor at the University of South Carolina Beaufort, upon the occasion of her retirement after years of outstanding service, and wish her continued success and happiness in all her future endeavors.

Be it further resolved that a copy of this resolution be presented to Dr. Lynn W. McGee.
----XX----
",Passed
1651025,Crescent HS sporting clays national champs,"








A senate RESOLUTION

TO RECOGNIZE AND HONOR THE CRESCENT HIGH SCHOOL SPORTING CLAYS TEAM, COACHES, AND SCHOOL OFFICIALS FOR AN OUTSTANDING SEASON AND TO CONGRATULATE THEM ON WINNING THE 2022 SCHOLASTIC CLAY TARGET PROGRAM NATIONAL CHAMPIONSHIP TITLE.

Whereas, the South Carolina Senate is pleased to learn that the members of the Crescent High School sporting clays team won the Scholastic Clay Target Program's national competition, held at the Cardinal Center in Marengo, Ohio, on July 15-16, 2022; and

Whereas, to the delight of enthusiastic Tiger fans, the Crescent Elite Shooters bested all comers with a final team score of 522 out of a possible 600 points in the championship tournament; and

Whereas, the Crescent High squad included sophomore Jed Dodgens, who led the way with 179 of 200 points; eighth-grader Quaid Busby, who contributed 173 of 200 points; and sophomore Maddox Martin, who nailed 170 of 200 points; and

Whereas, the team captured first place in the Sporting Clays Open Division; and

Whereas, in a sport that demands expertise and accuracy, Coach Lester Brock, Coach Rick Dodgens, and Coach Phillip Martin maximized their own ability and training in sporting clays to produce a championship caliber team and teach these athletes lessons that will prove invaluable throughout life; and

Whereas, the South Carolina Senate values the pride and recognition that the Crescent High School sporting clays team has brought to its school and community, and the members look to hear of the team's future success in the days to come. Now, therefore,

Be it resolved by the Senate:

That the members of the South Carolina Senate, by this resolution, recognize and honor the Crescent High School sporting clays team, coaches, and school officials for an outstanding season and congratulate them on winning the 2022 Scholastic Clay Target Program National Championship title.

Be it further resolved that a copy of this resolution be presented to Principal Cliff Roberts, Coach Lester Brock, Coach Rick Dodgens, and Coach Phillip Martin.
----XX----
",Passed
1651132,Retirement of Rep. Finlay,"








A house RESOLUTION

TO RECOGNIZE AND COMMEND THE HONORABLE Kirkman Finlay III  OF RICHLAND COUNTY FOR HIS DEDICATED SERVICE IN THE HOUSE OF REPRESENTATIVES ON BEHALF OF HIS CONSTITUENTS AND THE CITIZENS OF SOUTH CAROLINA AND TO WISH HIM MUCH SUCCESS AND HAPPINESS IN ALL HIS FUTURE ENDEAVORS.

Whereas, the members of the South Carolina House of Representatives learned with sincere regret that Representative Finlay left from the House of Representatives at the conclusion of his most recent term; and 

Whereas, born in Columbia on February 16, 1970, he is the son of Kirkman Finlay, Jr., and Mary Fleming ""Rab"" Finlay Thompson, and he earned a bachelor's degree from the University of Virginia; and 

Whereas, he married his beloved wife, Kathleen Ravenel, in 1997, and together they have reared three fine children: Kathleen ""Kay"" Hall Finlay, Mary Fleming Hampton Finlay, and Harriott Ravenel Finlay.  When away from his duties in the House of Representatives, he resides in Columbia and is a farmer and restaurateur; and 

Whereas, an active member of Church of the Apostles, Representative Finlay is deeply involved in his community and served on the Columbia City Council from 2006 to 2010; and 

Whereas, he has faithfully served the citizens of District 75 in the House of Representatives since 2013; most recently during that time he served on the Ways and Means Committee; and 

Whereas, in all of his service, Representative Finlay has provided the sharp insights of a businessman, along with the wisdom and common sense of a farmer; and 

Whereas, the members of the House of Representatives will miss the keen and impassioned service that     Kirkman Finlay, their friend and colleague, has given to the House of Representatives, and they hope that he will enjoy deep fulfillment in the years to come.  Now, therefore,

Be it resolved by the House of Representatives:

That the members of the South Carolina House of Representatives, by this resolution, recognize and commend the Honorable Kirkman Finlay III of Richland County for his dedicated service in the House of Representatives on behalf of his constituents and the citizens of South Carolina and wish him much success and happiness in all his future endeavors.

Be it further resolved that a copy of this resolution be presented to the Honorable Kirkman Finlay III.
----XX----
",Passed
1651144,Seneca Girls Golf Team,"








A senate RESOLUTION

TO CONGRATULATE THE Seneca high SCHOOL GIRLS golf TEAM, COACHES, AND SCHOOL OFFICIALS ON AN OUTSTANDING SEASON AND TO HONOR THEM FOR WINNING THE SOUTH CAROLINA CLASS 3a STATE CHAMPIONSHIP.

Whereas, the South Carolina Senate is proud to recognize the Seneca High School girls golf team for winning the South Carolina Class 3A state championship on October 25, 2022 at the Hackler Golf Course in Conway; and

Whereas, this historic win marks the program's first state championship in program history; and

Whereas, in the championship game, Seneca High School defeated Blue Ridge High School in Greenville County with a score of 657; and

Whereas, the Seneca High School Bobcats team played an impressive game with Skyler Martin and Hazel Martin both carding birdies on the second hole. By virtue of their top-ten individual finishes, Ansley Bryson and Mattie Padgett both earned All-State honors as they carded two-day totals of 154 and 156, respectively; and

Whereas, the Seneca High School girls golf team has flourished under the leadership and guidance of head Coach Kevin Padgett; and

Whereas, the members of the South Carolina Senate appreciate the pride and recognition that the Seneca High School girls golf team has brought to its school and community and look forward to a future filled with further accomplishments by the team and its talented athletes. Now, therefore,

Be it resolved by the Senate:

That the members of the South Carolina Senate, by this resolution, congratulate the Seneca High School girls golf team, coaches, and school officials on an outstanding season and honor them for winning the South Carolina Class 3A state championship.

Be it further resolved that a copy of this resolution be presented to the Seneca High School girls golf team, head Coach Kevin Padgett, and Principal Dylan Hudson.
----XX----
",Passed
1651184,Sally Cauthen Retirement,"








A senate RESOLUTION

TO CONGRATULATE SARAH ""SALLY"" CAUTHEN UPON THE OCCASION OF HER RETIREMENT AS RESEARCH DIRECTOR of THE SENATE EDUCATION COMMITTEE, TO COMMEND HER FOR HER SIXTEEN YEARS OF DEDICATED SERVICE TO THE SOUTH CAROLINA STATE SENATE, AND TO WISH HER MUCH HAPPINESS AND FULFILLMENT IN THE YEARS AHEAD.

Whereas, the members of the South Carolina Senate are pleased to recognize Sarah ""Sally"" Cauthen upon the occasion of her retirement from the Senate Education Committee; and

Whereas, Ms. Cauthen is an alumna the University of South Carolina; and

Whereas, Ms. Cauthen began her career in the banking sector before joining the South Carolina Senate in 2007; and

Whereas, Ms. Cauthen has set an example of dedication, experience, and leadership as Research Director. She has helped the staff of the State Senate understand the complex world of education policy; and

Whereas, Ms. Cauthen's service to the South Carolina Senate Education Committee has helped improve the quality of education for the children of South Carolina. Her work has made the schools of this State a better place to work and learn; and

Whereas, Ms. Cauthen has two sons, William Cauthen and Alexander Cauthen, and two sisters, Lisa Courson and Mary Exum; and

Whereas, the members of the South Carolina Senate appreciate the passion and dedication that Ms. Cauthen has shown in serving the people and the State of South Carolina. Now, therefore,; and

Be it resolved by the Senate:; and

That the members of the South Carolina Senate, by this resolution, congratulate Sarah ""Sally"" Cauthen upon the occasion of her retirement as Senate Education Research Director, commend her for her sixteen years of dedicated service to the South Carolina Senate, and wish her much happiness and fulfillment in the years ahead.; and

Be it further resolved that a copy of this resolution be presented to Sarah ""Sally"" Cauthen.; and
----XX----
",Passed
1652069,Iris Hill,"








A senate RESOLUTION

TO CONGRATULATE ms. IRIS HILL UPON THE OCCASION OF her fourteenth anniversary as town administrator AND TO COMMEND her for her MANY YEARS OF DEDICATED SERVICE TO THE edisto beach COMMUNITY AND THE PEOPLE AND THE STATE OF SOUTH CAROLINA.

Whereas, the members of the South Carolina Senate are pleased to recognize Ms. Iris Hill as she celebrates this important milestone; and

Whereas, Ms. Hill was appointed as Town Administrator of Edisto Beach on February 16, 2009; and

Whereas, throughout Ms. Hill's tenure with the town of Edisto Beach, she worked successfully and diligently with town mayors and councilmembers and displayed an unwavering commitment to the promotion and betterment of the town of Edisto Beach; and

Whereas, during Ms. Hill's tenure as Town Administrator, her exemplary standards for professionalism in decision-making and work performance have strengthened the town of Edisto Beach, its residents, and its town hall employees; and

Whereas, with balanced budgets, outstanding audits, high bond ratings, structured budget line items, grants, long-range fiscal planning, and viable benefits for town employees, Ms. Hill secured Edisto Beach's fiscal stability; and

Whereas, Ms. Hill spearheaded several Edisto Beach projects and initiatives, including a twenty-million-dollar beach renourishment program and a comprehensive beach management plan, the growth of the police and fire departments, the establishment of an eight-million-dollar water improvement project, a million-dollar drainage improvement project, a sidewalk enhancement project, the development of Bay Creek Park, utility upgrades, street improvements, recreational improvements, and the establishment of AirMed medical service, among others; and

Whereas, Ms. Hill's outstanding effort in coordinating and managing these initiatives and projects has earned her achievement awards from the Municipal Association of South Carolina, including an award in 2012 for the Bay Creek Park Project; an award in 2013 for the Public Access Improvement Project; an award in 2016 for the Sidewalk Enhancement Project; an award in 2018 for the Edisto Beach Nourishment Program; an award in 2020 for the Edisto Beach Water Improvement Project; and an award in 2022 for Edisto Beach's First Master Recreation Plan; and

Whereas, Ms. Hill has prepared her town for hurricanes and other emergencies and has worked with federal, state, and regional agencies to have procedures in place to keep the town residents, employees, visitors, facilities, and buildings as safe as possible. In working with these agencies before, during, and after seven named hurricanes, she has helped the town receive millions of dollars in state and federal financial assistance for beach nourishment, property damage, and other emergency protective measures; and

Whereas, Ms. Hill has represented the Town of Edisto Beach diligently and exceptionally in community and professional organizations, including the South Carolina Beach Advocates Board of Directors, the South Carolina Municipal Insurance Trust Board of Trustees, the South Carolina Beach Preservation Stakeholder Workgroup, the South Carolina City and County Managers Association, the Colleton County Long Term Recovery Group, the International City/County Management Association, the Governmental Finance Officers Association, the Small Cities Coalition, the Lowcountry Food Bank Volunteer group, and the Town of Edisto Beach Volunteer Firefighters; and

Whereas, in addition to Ms. Hill's impressive achievements, she has also left a legacy of mentoring and leading Town Hall staff and employees. Her example will serve the town of Edisto Beach well into the future; and

Whereas, the Senate of South Carolina greatly appreciates Ms. Hill's years of professional service, guidance, and leadership of the town of Edisto Beach, and expresses gratitude for her fourteen years of service as Town Administrator. Now, therefore,

Be it resolved by the Senate:

That the members of the South Carolina Senate, by this resolution, congratulate Ms. Iris Hill upon the occasion of her fourteenth anniversary as Town Administrator and commend her for her many years of dedicated service to the Edisto Beach community and the people and the State of South Carolina.

Be it further resolved that a copy of this resolution be presented to Ms. Iris Hill.
----XX----
",Passed
